question,answer,image_urls
Has someone ever tricked you into eating something that is not a part of your regular diet (Ex: a vegetarian fed meat)? What happened?,I wasn't really tricked into it (but know people that have been). I am gluten free. At my grandad's funeral my mum had told the catering that I was gluten free. They assured it would be ok. They brought out some sandwiches and put them with the rest of the buffet. I asked if they were gluten free. They said yes. I brought them to the table and looked at them and didn't trust them. Everyone else was eating but I sat there. My mum took them to the kitchen and they double checked. Yes they were gluten free. I still wasn't convinced. My mum convinced me to just eat one because they assured us they were fine and I couldn't not eat anything. Against my better judgement I did. I was sick 5 times on the 3 hour car journey home. I've learnt to always trust my gut and my mum knows now to always trust me too.,['https://qph.cf2.quoracdn.net/main-thumb-ti-1753110-50-mjoqlayaadvjuenqflbphyosnvkvcoxx.jpeg']
Why doesn’t my gluten-free bread taste good? How can I get the taste and texture the same as gluten-containing bread? Does anyone have a good recipe?,"The person who does will make a fortune. Gluten is what gives bread its distinctive texture and taste Rather than trying to make a gluten free copy of gluten bread, why not eat a different sort of bread? Make irish soda bread with gluten free oats for a more solid, textured bread with a distinctive taste. Also very easy to make: oats, bicarb of soda, salt and buttermilk, and whatever you want to add. It doesn't require proving or a lot of kneading and you can have a loaf of warm bread on the table in half an hour.",['https://qph.cf2.quoracdn.net/main-thumb-212743660-50-siuzywpprhuzjltwhxvrwkqoqqhqyzkh.jpeg']
What commonly-believed myths about diet and nutrition annoy you the most?,"As a baker: the unsubstantiated and uninformed worry about gluten. True story: Lady comes to my bakery. Grabs a sample, stuffs it into her mouth. Asks ""Do you have anything gluten free?"" I think ""Lady, if you would be really gluten intolerant you wouldn't just eat any piece of bread you see on a plate"". What I say is my standard reply: ""No sorry, I don't do gluten free because I can't keep it separate from the normal bread making."" She says ""Ahh well, then I take a French Seed batard"" and choses the bread with the most gluten. Arrgghhh. Don't get me wrong, coeliac is a horrible disease. I don't talk about those people who suffer from it. A good friend suffers from it and I know what it is. But this latest fashion, that gluten is the new evil and is made by satan himself drives me crazy. People who say ""I skip the gluten and I feel so much better"" while munching on a ""bread"" (quotes intentional) which is made with artificial emulsifiers, loaded with sugars and other shite. Other pet hate: People who don't understand that a calorie is a unit for energy. They talk about good calories and bad calories. I usually ask them one question: ""What do you think is the longer distance, 1 km/mile travelled by foot or 1 km/mile driven in a car?"" or ""What is heavier? 10 kg of feathers or 10 kg of lead?"" Uhh I feel so much better now. Thanks for listening. Lol.",['https://qph.cf2.quoracdn.net/main-thumb-135695410-50-qtnmertvjjnjnrtmvvfaraeeabrrzjsb.jpeg']
Is pasta healthier for you if it's gluten free?,"No. Gluten is just a protein. It not only binds the starch together to give pasta structure and bite, it also provides lots of nutrition and healthy ammino acids, which make pasta (in the right amounts) a healthy food. A small percentage of people suffer gron celiac disease or other forms of gluten sensitivity (none of these other forms have been scientifically proven) and can't eat gluten. For everyone else gluten is perfectly OK. Gluten free products are made with lesser flours with binders to hold them together and additives to hide unpleasant flavors. They are a necessity for those people who can't eat gluten, but they are significantly less nutritional and healthy than the regular product containing gluten for everyone else.",['https://qph.cf2.quoracdn.net/main-thumb-956390-50-s5VGN0mUs71cQeEapdJdPhcq41EyfbTA.jpeg']
What is the difference between inorganic zinc and organic zinc?,"About 227%, according to a quick Amazon search. In dollars, that is. “Organic” zinc is marketing hype for rubes. Zinc is, by definition, an inorganic mineral. It is neither grown nor raised, so “organic” standards for, say, crops or livestock don’t apply. Organic zinc is like non-GMO salt: Or organic water: It’s a way to bleed money from the dumb, the gullible, the undereducated, and the easily manipulated. Hey, I’ve got it! There’s surely a market for organic, non-GMO, all-natural, gluten-free asbestos.","['https://qph.cf2.quoracdn.net/main-thumb-4885040-50-stUmLZrbJDTFFYfUXxtcCfdsL9q7OeQc.jpeg', 'https://qph.cf2.quoracdn.net/main-qimg-cc4b39346efcf19611edc2029002d765-lq', 'https://qph.cf2.quoracdn.net/main-qimg-b48f13756d668a9cce5ff7d2a875bc71-lq']"
What can I do if I’m the only gluten-free person at a party?,"If you are a diagnosed Celiac you either notify the host with enough time for them to make accommodations, or you avoid the foods that may have gluten. If you’re avoiding gluten by preference, you could just eat what’s served.",['https://qph.cf2.quoracdn.net/main-thumb-14361-50-tsbulbwceecydqjgnhaidlzqnfmcvzie.jpeg']
My wife says cleaning the house for her is romantic. Is it?,"I'll tell you what is definitely unromantic: not listening to your wife and trying to get a bunch of internet strangers to contradict her. Your beloved has made a request. It's easy to honor. It's inexpensive. It's a responsible activity. It's even low calorie and gluten free! This isn't that hard. I've done the laundry, most of the cooking, and a fair subset of other chores throughout 23 years of marriage. From all appearances, my wife finds it very conducive to romance.",['https://qph.cf2.quoracdn.net/main-thumb-38709882-50-ystomutgyckhjvxqitrllzjbnhmrwxyr.jpeg']
"Is gluten bad for everyone, and should I go gluten-free even if I don't suffer any symptoms?","Absolutely not. Humans have been eating gluten since we found out that grass seeds are edible, and the rise of agriculture led to explosive evolution of our digestion: genes for digesting gluten doubled and doubled again, so we are now very efficient at digesting it. On average, that is. If you do suffer symptoms, and especially if you have seen a doctor about it to confirm that gluten intolerance is indeed your problem, then you should of course refrain from eating gluten.",['https://qph.cf2.quoracdn.net/main-thumb-171207913-50-nuvrqsmqmbtmomaogamujiulbffsybnj.jpeg']
What does gluten do in wheat flour?,"First of all what is gluten? It is not a poison or an additive, it’s just the natural proteins of the wheat (and other grains, not all grains). It’s an important nutrient and perfectly healthy for most people. The “network” created by gluten in a dough When you make a dough, kneading the gluten creates a net structure that gives cohesion to the dough and make it strong, so that it does not melt while boiling. If you knead a bread, the gluten makes it possible for the dough to ferment with the help of yeast or sourdough. The gluten traps in the gasses produced by this fermentation and create a light, flavorful bread. Gluten-free flours can’t create this structure, so the dough can’t trap the gasses created by the fermentation. This means that in order to make gluten-free bread one must add “adhesives” like egg or Arabic gum (or other less healthy additives), and flavors to make the tastes more agreeable.","['https://qph.cf2.quoracdn.net/main-thumb-956390-50-s5VGN0mUs71cQeEapdJdPhcq41EyfbTA.jpeg', 'https://qph.cf2.quoracdn.net/main-qimg-42537d480c906237d2852021c3edb775-lq', 'https://qph.cf2.quoracdn.net/main-qimg-06c9afbcddac2d6b96d7a0ea32f37747-lq']"
What are the cons of going on a gluten free diet if you do not have a gluten allergy?,"Absent a valid medical reason to avoid gluten, the cons include:",['https://qph.cf2.quoracdn.net/main-thumb-14361-50-tsbulbwceecydqjgnhaidlzqnfmcvzie.jpeg']
Is kosher food like gluten-free or low-cholesterol food? Why do we use so many colorful adjectives when it comes to advertising our wares to the general public? Isn't food food?,"No. Kosher food is food that conforms to Jewish laws about permissible and non-permissible foodstuffs. Gluten-free food is food that people with Coeliac disease can eat without suffering agonising bloating, diarrhea, intestinal bleeding, and cramps. Low-cholestorol food is food for people who are trying to control their cholestorol and would prefer not to suffer blocked arteries or pop their clogs from a heart attack. So, no. Food isn’t all just “food”.",['https://qph.cf2.quoracdn.net/main-thumb-135320241-50-hcwqcvhmsxytmcdmomnjcfxrrbqwwazr.jpeg']
Is Turkey Hill homemade vanilla ice cream gluten-free?,"Turkey Hill is one of the lowest quality widely available ice creams on the market, and while the “vanilla” flavor is gluten free, it is also remarkably free of vanilla, consisting instead of a synethic compound sourced from sawdust to imitate vanilla flavor, along with mono and diglycerides, carrageenan (a seaweed extract) and cellulose gel. Yum!","['https://qph.cf2.quoracdn.net/main-thumb-416998279-50-nekannhsldvddmlumimnumqrpddnpssx.jpeg', 'https://qph.cf2.quoracdn.net/main-qimg-c6d94073cd2eefd4d0577b946c919624-lq']"
"My bread says “contains traces of gluten, wheat, and yeast”, not “May”. I attempt to buy bread without gluten, wheat, or yeast in the ingredients. Does this mean that these items are significant in my product or is it just an allergen warning?","It is an allergen warning. Now, if you have celiac disease, you can't eat this bread, and that's it. If you don't, nor suffer from non-celiac gluten sensitivity (supposing that it actually exists, but let's err on the side of caution), you have absolutely no reason to avoid gluten. Indeed, you have all reasons to stay away from gluten-free products. What is gluten? It’s just a protein. It’s actually the main protein in wheat flour, and allows things like proofing. When you knead your dough, it forms strands like those above that kind of “tie” the dough together and make it texturally whole. As you have added yeast or sourdough to your dough, you can then proof it. Yeast is a microorganism that essentially eats some of the starch in your dough and produce gases that make the bread dough rise and become light and fluffy. Besides, they change the taste of the dough, making it more delicious without adding flavorings. A good bread is indeed made only with four ingredients: flour, water, yeast or sourdough, and a pinch of salt. If your dough has enough gluten, and it has been properly developed, the gases produced while proofing will be secured inside the dough, which (as said) will become airy, light, fluffy, and produce a delicious bread. But if your dough does not have enough gluten (or has no gluten at all), the gases escape, and it will not rise. In other words, if your bread has the right amount of gluten, and it has been developed properly, it will look like this once baked, and it will be delicious even if it is made with only the abovementioned four ingredients. What happens when you try to make bread without gluten (or with not enough gluten)? Without gluten, the dough will not be able to “knit” itself and hold in enough gases. The result will be a stodgy, heavy, flavorless mess. In order to make gluten-free bread rise, you need to add to the dough extra ingredients (such as cellulose derivatives, natural and edible gums, food glues such as fish glue, etc.) that hold in the gases. Besides, they don’t work well with yeast or sourdough, so they are usually raised artificially, which in turn prevents the dough from maturing and becoming naturally delicious. As a consequence, gluten-free breads have flavorings such as fats, sugar, etc. added to enhance their flavor. Gluten-free breads and other foods are a necessity for people who have very specific conditions, but they are not healthier than a good quality artisanal loaf. They have a much higher glycemic index, far less fiber, they are poor in proteins, and much richer in fats. Unless you are celiac (in which case you should not eat any food that isn’t allowed for celiacs) you should always avoid gluten-free products if you want to eat a healthy diet.","['https://qph.cf2.quoracdn.net/main-thumb-956390-50-s5VGN0mUs71cQeEapdJdPhcq41EyfbTA.jpeg', 'https://qph.cf2.quoracdn.net/main-qimg-42537d480c906237d2852021c3edb775-lq', 'https://qph.cf2.quoracdn.net/main-qimg-35a911931cbd7c9782b3c09649e299f6', 'https://qph.cf2.quoracdn.net/main-qimg-d1da87587504423a8a913d3d52958e19-lq', 'https://qph.cf2.quoracdn.net/main-qimg-ee60d62204196740c84ea49c78cfe626-lq']"
